{
  "$schema": "http://json-schema.org/draft-04/schema#",
  "description": "",
  "type": "object",
  "properties": {
    "orderId": {
      "type": "string",
      "minLength": 1
    },
    "customerId": {
      "type": "string",
      "minLength": 1
    },
    "region": {
      "type": "string",
      "minLength": 1
    },
    "status": {
      "type": "string",
      "minLength": 1
    },
    "orderDetails": {
      "type": "array",
      "items": {
        "type": "object",
        "required": [
          "productId",
          "productName",
          "quantity",
          "unitPrice"
        ],
        "properties": {
          "productId": {
            "type": "string",
            "minLength": 1
          },
          "productName": {
            "type": "string",
            "minLength": 1
          },
          "quantity": {
            "type": "number"
          },
          "unitPrice": {
            "type": "number"
          }
        }
      }
    }
  },
  "required": [
    "orderId",
    "customerId",
    "region",
    "status",
    "orderDetails"
  ]
}